{
  "factory_root": "/home/orchadmin/project-pack-factory",
  "local_scratch_root": "/home/orchadmin/project-pack-factory/.pack-state/local-scratch",
  "local_stage_root": "/home/orchadmin/project-pack-factory/.pack-state/local-scratch/remote-autonomy-staging/codex-personal-assistant-daily-driver-build-pack-v1-uat-autonomous-run-v21",
  "remote_export_dir": "~/packfactory-source__adf-dev__autonomous-build-packs/codex-personal-assistant-daily-driver-build-pack-v1/dist/exports/runtime-evidence",
  "remote_pack_dir": "~/packfactory-source__adf-dev__autonomous-build-packs/codex-personal-assistant-daily-driver-build-pack-v1",
  "remote_run_dir": "~/packfactory-source__adf-dev__autonomous-build-packs/codex-personal-assistant-daily-driver-build-pack-v1/runs/codex-personal-assistant-daily-driver-build-pack-v1-uat-autonomous-run-v21",
  "remote_target_label": "adf-dev",
  "run_id": "codex-personal-assistant-daily-driver-build-pack-v1-uat-autonomous-run-v21",
  "schema_version": "scratch-lifecycle/v1",
  "source_build_pack_id": "codex-personal-assistant-daily-driver-build-pack-v1",
  "status": "completed",
  "updated_at": "2026-03-31T16:43:03Z"
}
