{
  "factory_root": "/home/orchadmin/project-pack-factory",
  "local_scratch_root": "/home/orchadmin/project-pack-factory/.pack-state/local-scratch",
  "local_stage_root": "/home/orchadmin/project-pack-factory/.pack-state/local-scratch/remote-autonomy-staging/algosec-diagnostic-framework-successor-build-pack-v1-adf-dev-algosec-dr-primary-150-shallow-surface-map-v1",
  "remote_export_dir": "~/packfactory-source__adf-dev__autonomous-build-packs/algosec-diagnostic-framework-successor-build-pack-v1/dist/exports/runtime-evidence",
  "remote_pack_dir": "~/packfactory-source__adf-dev__autonomous-build-packs/algosec-diagnostic-framework-successor-build-pack-v1",
  "remote_run_dir": "~/packfactory-source__adf-dev__autonomous-build-packs/algosec-diagnostic-framework-successor-build-pack-v1/runs/algosec-diagnostic-framework-successor-build-pack-v1-adf-dev-algosec-dr-primary-150-shallow-surface-map-v1",
  "remote_target_label": "adf-dev",
  "run_id": "algosec-diagnostic-framework-successor-build-pack-v1-adf-dev-algosec-dr-primary-150-shallow-surface-map-v1",
  "schema_version": "scratch-lifecycle/v1",
  "source_build_pack_id": "algosec-diagnostic-framework-successor-build-pack-v1",
  "status": "completed",
  "updated_at": "2026-04-03T22:54:28Z"
}
